{
  "schemaVersion": 1,
  "target": {
    "release": "WAP 1.2.1",
    "markup": "WML 1.3",
    "compatibilityFloor": "strict-historical-observable-behavior",
    "implementationClaim": "pre-conformance",
    "certificationClaim": "none"
  },
  "profiles": [
    {
      "id": "class-c-data-client",
      "role": "primary-strict-target",
      "status": "selected-from-wap-215",
      "summary": "Exact CCR-CLASSC-C-001 data-client profile: WAE, WML, WBXML, WMLScript, WMLScript libraries, caching, WSP, WDP, and WCMP mandatory client features. WTP becomes mandatory only when connection-mode WSP is supported; security, push, telephony, identity, and UAProf remain separately declared."
    },
    {
      "id": "class-b-telephony-client",
      "role": "optional-future-profile",
      "status": "deferred",
      "summary": "Adds mandatory telephony, push, and security profile behavior after strict Class C closure."
    },
    {
      "id": "class-a-complete-client",
      "role": "optional-future-profile",
      "status": "deferred",
      "summary": "Makes mandatory and optional release features mandatory; not part of the first compliance release."
    },
    {
      "id": "waves-enhanced",
      "role": "additive-extension-mode",
      "status": "planned",
      "summary": "Modern features and improved behavior that preserve strict results or are explicitly separated from strict mode."
    }
  ],
  "executionPolicy": {
    "strictBeforeEnhancement": true,
    "completedTicketsImmutable": true,
    "runtimeChangesRequireSourceAnchor": true,
    "sourceQualityChecksRemainManual": true,
    "binarySourcePromotionRequiresRedistributionApproval": true,
    "redistributionBlockDoesNotBlockInternalEvidence": true
  },
  "sprints": [
    {
      "id": "SRC-0",
      "title": "Authoritative source control plane",
      "status": "blocked",
      "dependsOn": [],
      "goal": "Lock the complete release, its supporting assets, class governance, and legal retrieval posture before implementation claims are expanded.",
      "workItems": [
        {
          "id": "SRC-001",
          "status": "done",
          "ownerLayers": ["spec-processing", "documentation"],
          "sourceFamilies": ["architecture", "conformance-governance"],
          "existingTickets": [],
          "outputs": [
            "spec-processing/source-manifests/wap-1.2.1-release.json",
            "spec-processing/scripts/check-wap-release-manifest.mjs"
          ],
          "acceptance": [
            "All 97 technical release members have authority URLs, hashes, sizes, family classifications, and local-state comparisons."
          ],
          "evidence": [
            "node spec-processing/scripts/check-wap-release-manifest.mjs"
          ]
        },
        {
          "id": "SRC-002",
          "status": "done",
          "ownerLayers": ["spec-processing", "documentation"],
          "sourceFamilies": ["conformance-governance"],
          "existingTickets": [],
          "outputs": [
            "spec-processing/source-manifests/wap-1.2.1-effective-spec.json",
            "spec-processing/scripts/check-wap-effective-spec.mjs"
          ],
          "acceptance": [
            "Every release member belongs to one family and approved base/SIN order is explicit; proposed documents are excluded from normative sequences."
          ],
          "evidence": [
            "node spec-processing/scripts/check-wap-effective-spec.mjs"
          ]
        },
        {
          "id": "SRC-003",
          "status": "done",
          "ownerLayers": ["spec-processing", "documentation"],
          "sourceFamilies": ["associated-assets"],
          "existingTickets": [],
          "outputs": [
            "Six-entry WAP 1.2.1 DTD asset lock"
          ],
          "acceptance": [
            "Channel, WML, PAP, SI, SL, and WTA-WML DTD URLs, sizes, and SHA-256 hashes are recorded without committing restricted content."
          ],
          "evidence": [
            "node spec-processing/scripts/check-wap-release-manifest.mjs"
          ]
        },
        {
          "id": "SRC-004",
          "status": "done",
          "ownerLayers": ["spec-processing", "documentation"],
          "sourceFamilies": ["conformance-governance"],
          "existingTickets": [],
          "outputs": [
            "Verified WAP-215 Class Conformance Requirements source lock",
            "Exact Class C/B/A dependency graph",
            "spec-processing/source-manifests/wap-1.2.1-class-conformance.json",
            "spec-processing/scripts/check-wap-class-conformance.mjs",
            "docs/waves/WAP_SOURCE_RECOVERY_AND_PERMISSION.md"
          ],
          "acceptance": [
            "The official WAP Forum WAP-215 payload is byte-locked and all six Class A/B/C client/server tables are extracted with exact identifiers and resolved release families."
          ],
          "evidence": [
            "node spec-processing/scripts/check-wap-release-manifest.mjs",
            "node spec-processing/scripts/check-wap-class-conformance.mjs"
          ]
        },
        {
          "id": "SRC-005",
          "status": "done",
          "ownerLayers": ["spec-processing", "documentation"],
          "sourceFamilies": ["external-dependencies"],
          "existingTickets": [],
          "outputs": [
            "spec-processing/source-manifests/wap-1.2.1-external-dependencies.json",
            "spec-processing/source-manifests/wap-1.2.1-external-ingestion-status.json",
            "docs/waves/WAP_1_2_1_EXTERNAL_DEPENDENCIES.md",
            "W3C/IETF/ISO/Unicode dependency lock",
            "Dependency applicability and supersession review"
          ],
          "acceptance": [
            "Every normative external reference in strict-target families has authority metadata and is classified as definition-only, implementation-relevant, or test-relevant.",
            "The selected TIAEIA-732 bearer citation has normalized part/version metadata and an explicit licensed-access disposition."
          ],
          "evidence": [
            "node scripts/check-wap-external-dependencies.mjs",
            "node spec-processing/scripts/check-wap-external-ingestion-status.mjs"
          ]
        },
        {
          "id": "SRC-006",
          "status": "blocked",
          "ownerLayers": ["spec-processing", "documentation"],
          "sourceFamilies": ["conformance-governance"],
          "existingTickets": ["T0-16", "T0-17"],
          "outputs": [
            "spec-processing/source-manifests/wap-1.2.1-ingestion-status.json",
            "spec-processing/scripts/check-wap-ingestion-status.mjs",
            "Approved staged recovery of 27 missing and 3 divergent high-value release members",
            "Verified cleaned-source promotion and append-only provenance snapshot"
          ],
          "acceptance": [
            "All 97 technical members and text extractions have private hash/size evidence before promotion.",
            "Redistribution is explicitly approved before binaries or parsed derivatives enter Git; afterward each promoted source matches the source lock and passes the existing manual cleanup workflow."
          ],
          "evidence": [
            "manual: redistribution approval record",
            "node spec-processing/scripts/check-wap-release-manifest.mjs",
            "node spec-processing/scripts/check-wap-ingestion-status.mjs",
            "spec-processing/scripts/generate-docling-provenance.sh"
          ]
        }
      ],
      "exitGates": [
        "Release and effective-spec validators pass.",
        "The WAP-215 source lock and exact selected Class C client graph pass validation.",
        "No recovered binary or parsed derivative is committed without redistribution approval."
      ]
    },
    {
      "id": "CONF-1",
      "title": "CCR, SCR, and normative obligation ledgers",
      "status": "done",
      "dependsOn": ["SRC-0"],
      "goal": "Replace thematic coverage estimates with one-to-one conformance accounting for the selected client profile.",
      "workItems": [
        {
          "id": "CONF-001",
          "status": "done",
          "ownerLayers": ["documentation", "qa"],
          "sourceFamilies": ["architecture", "conformance-governance"],
          "existingTickets": [],
          "outputs": [
            "Class C client CCR dependency graph",
            "Class B/A optional profile graphs",
            "spec-processing/source-manifests/wap-1.2.1-class-conformance.json"
          ],
          "acceptance": [
            "Every Class A/B/C client and server dependency is extracted from WAP-215, and every selected Class C client dependency resolves to an effective release family and feature group."
          ],
          "evidence": [
            "node spec-processing/scripts/check-wap-class-conformance.mjs",
            "node scripts/check-wap-conformance-ledger.mjs"
          ]
        },
        {
          "id": "CONF-002",
          "status": "done",
          "ownerLayers": ["documentation", "qa"],
          "sourceFamilies": [
            "wae",
            "wml",
            "wbxml",
            "wmlscript",
            "wmlscript-libraries",
            "caching",
            "wdp",
            "wsp",
            "wcmp"
          ],
          "existingTickets": ["R0-01", "W1-05"],
      "outputs": [
        "Machine-readable effective SCR ledger for every Class C family",
        "spec-processing/source-manifests/wap-1.2.1-wml-scr.json",
        "spec-processing/source-manifests/wap-1.2.1-wae-scr.json",
        "spec-processing/source-manifests/wap-1.2.1-wbxml-scr.json",
        "spec-processing/source-manifests/wap-1.2.1-wmlscript-scr.json",
        "spec-processing/source-manifests/wap-1.2.1-wmlscript-libraries-scr.json",
        "spec-processing/source-manifests/wap-1.2.1-caching-scr.json",
        "spec-processing/source-manifests/wap-1.2.1-wdp-scr.json",